DDODesc,MAJOR,RECEIPTHEAD,BOOKDATE,Tenderer,Challan,NETRECEIPT
SML03-002-B.D.O.BASANTPUR,0070-OTHER ADMINISTRATIVE SERVICES,0070-60-118-01-RECEIPT FROM RIGHT TO INFORMATION ACT,31/05/2017,"[G0070000004] HIMGRN:B17E122173, BDOBASANTPUR RECEIPT FROM RIGHT TO INFORMATION ACT -No. DBB/3239",1,140
SML03-002-B.D.O.BASANTPUR,0070-OTHER ADMINISTRATIVE SERVICES,0070-60-118-01-RECEIPT FROM RIGHT TO INFORMATION ACT,31/07/2017,"[I0070000002] HIMGRN:B17G110783, BDO BASANTPUR RECEIPT FROM RIGHT TO INFORMATION ACT -IPO AMOUNT RS100 ONLLY DBB7484",1,100
SML03-002-B.D.O.BASANTPUR,0070-OTHER ADMINISTRATIVE SERVICES,0070-60-118-01-RECEIPT FROM RIGHT TO INFORMATION ACT,31/10/2017,"[L0070000001] HIMGRN:B17J108428, BLOCKDEVELOPMENT OFFICER BASANTPUR RECEIPT FROM RIGHT TO INFORMATION ACT -RECIEPT FROM RIGHT TO INFORMATION ACT2005 IPOAMOUNTRS100",1,100
SML03-002-B.D.O.BASANTPUR,0070-OTHER ADMINISTRATIVE SERVICES,0070-60-118-01-RECEIPT FROM RIGHT TO INFORMATION ACT,31/03/2018,"[E0070000002] HIMGRN:B18C143849, BLOCK DEVELOPEMENT BASANTPUR RECEIPT FROM RIGHT TO INFORMATION ACT -",1,40
SML03-002-B.D.O.BASANTPUR,0070-OTHER ADMINISTRATIVE SERVICES,0070-60-118-01-RECEIPT FROM RIGHT TO INFORMATION ACT,31/07/2018,"[I0070000004] HIMGRN:B18G128382, BDO BASANTPUR RECEIPT FROM RIGHT TO INFORMATION ACT -",1,40
SML03-002-B.D.O.BASANTPUR,0515-OTHER RURAL DEVELOPMENT PROGRAMMES,0515-00-102-02-MISCELLANEOUS,31/05/2017,"[G0515000001] HIMGRN:B17E106305, BDO BASANTPUR MISCELLANEOUS -deposited of interest amount accrued from account number 0869001000 45016 for the per",1,50080
SML03-002-B.D.O.BASANTPUR,0515-OTHER RURAL DEVELOPMENT PROGRAMMES,0515-00-102-02-MISCELLANEOUS,31/05/2017,"[G0515000002] HIMGRN:B17E122155, BDOBASANTPUR MISCELLANEOUS -",1,23500
SML03-002-B.D.O.BASANTPUR,0515-OTHER RURAL DEVELOPMENT PROGRAMMES,0515-00-102-02-MISCELLANEOUS,27/04/2018,"[F0515000001] HIMGRN:B18C166115, BDO BASANTPUR MISCELLANEOUS -deposite if intrest amount accrued from account number 086900100045016 for the period",1,43699
