DDODesc,MAJOR,RECEIPTHEAD,BOOKDATE,Tenderer,Challan,NETRECEIPT
LHL00-205-GSSS JAHALMM,"0202-EDUCATION SPORTS,ARTS & CULTURE",0202-01-102-01-TUITION AND OTHER FEES,28/07/2017,"[I0202000011] HIMGRN:b17g145312, PRINCIPAL TUITION AND OTHER FEES -",1,2560
LHL00-205-GSSS JAHALMM,"0202-EDUCATION SPORTS,ARTS & CULTURE",0202-01-102-01-TUITION AND OTHER FEES,24/11/2017,"[M0202000004] HIMGRN:B17K119145, PRINCIPAL G SSS JAHLMAN TUITION AND OTHER FEES -TUTION FEE, ADMISSION FEE AND S. L. C.",1,930
LHL00-205-GSSS JAHALMM,"0202-EDUCATION SPORTS,ARTS & CULTURE",0202-01-102-01-TUITION AND OTHER FEES,05/05/2018,"[G0202000005] HIMGRN:B18E109755, PRINCIPAL TUITION AND OTHER FEES -",1,2385
LHL00-205-GSSS JAHALMM,"0202-EDUCATION SPORTS,ARTS & CULTURE",0202-01-102-01-TUITION AND OTHER FEES,19/07/2018,"[I0202000006] HIMGRN:B18G128715, PRINCIPAL TUITION AND OTHER FEES -",1,870
LHL00-205-GSSS JAHALMM,"0202-EDUCATION SPORTS,ARTS & CULTURE",0202-01-102-03-MISCELLANEOUS RECEIPTS,19/07/2018,"[I0202000007] HIMGRN:B18G128695, PRINCIPAL MISCELLANEOUS RECEIPTS -",1,12790
LHL00-205-GSSS JAHALMM,"0202-EDUCATION SPORTS,ARTS & CULTURE",0202-01-600-01-RECOVERIES OF OVER PAYMENT,27/09/2017,"[K0202000007] HIMGRN:B17I124618, PRINCIPAL RECOVERIES OF OVER PAYMENT -",1,250
