DDODesc,MAJOR,RECEIPTHEAD,BOOKDATE,Tenderer,Challan,NETRECEIPT
HMR04-218-HM GHS BARARA,"0202-EDUCATION SPORTS,ARTS & CULTURE",0202-01-102-01-TUITION AND OTHER FEES,22/05/2017,"[G0202000005] HIMGRN:B17E111850, HEADMASTER GHS BARARA TUITION AND OTHER FEES -Admission and SLC Fee",1,205
HMR04-218-HM GHS BARARA,"0202-EDUCATION SPORTS,ARTS & CULTURE",0202-01-102-01-TUITION AND OTHER FEES,22/05/2017,"[G0202000026] HIMGRN:B17E132703, HEADMASTER TUITION AND OTHER FEES -SLC Fee",1,70
HMR04-218-HM GHS BARARA,"0202-EDUCATION SPORTS,ARTS & CULTURE",0202-01-102-01-TUITION AND OTHER FEES,29/09/2017,"[K0202000009] HIMGRN:B17I124042, HM GHS BARARA TUITION AND OTHER FEES -Adm and SLC Fee",1,10
HMR04-218-HM GHS BARARA,"0202-EDUCATION SPORTS,ARTS & CULTURE",0202-01-102-01-TUITION AND OTHER FEES,22/05/2018,"[G0202000031] HIMGRN:B18E123936, HEADMASTER TUITION AND OTHER FEES -Admission and SLC Fee",1,110
HMR04-218-HM GHS BARARA,"0202-EDUCATION SPORTS,ARTS & CULTURE",0202-01-102-01-TUITION AND OTHER FEES,06/07/2018,"[I0202000002] HIMGRN:B18G101056, HM GHS BARARA TUITION AND OTHER FEES -SLC and Admission Fee",1,45
HMR04-218-HM GHS BARARA,"0202-EDUCATION SPORTS,ARTS & CULTURE",0202-01-600-01-RECOVERIES OF OVER PAYMENT,22/05/2018,"[G0202000028] HIMGRN:B18E123921, HEADMASTER RECOVERIES OF OVER PAYMENT -Recovery of over payment for the month of July 2015 and July 2016",1,1011
HMR04-218-HM GHS BARARA,8011-INSURANCE AND PENSION FUNDS,8011-00-107-01-INSURANCE FUND,22/05/2018,"[G8011000003] HIMGRN:B18E123793, HEADMASTER SAVING FUND INSURANCE FUND -",1,792
HMR04-218-HM GHS BARARA,8011-INSURANCE AND PENSION FUNDS,8011-00-107-02-SAVING FUND,22/05/2018,"[G8011000003] HIMGRN:B18E123793, HEADMASTER SAVING FUND INSURANCE FUND -",1,1848
