DDODesc,MAJOR,RECEIPTHEAD,BOOKDATE,Tenderer,Challan,NETRECEIPT
SMR02-217-PRINCIPAL,0070-OTHER ADMINISTRATIVE SERVICES,0070-60-118-01-RECEIPT FROM RIGHT TO INFORMATION ACT,22/05/2018,"[G0070000017] HIMGRN:B18E123096, PIO CUM PRINCIPAL GSSS HARIPUR KHOL RECEIPT FROM RIGHT TO INFORMATION ACT -",1,50
SMR02-217-PRINCIPAL,"0202-EDUCATION SPORTS,ARTS & CULTURE",0202-01-102-01-TUITION AND OTHER FEES,22/05/2017,"[G0202000014] HIMGRN:B17E116131, PRINCIPAL HARIPUR KHOL DISTT SIRMOUR HP TUITION AND OTHER FEES -Adm.Fees, Re-Adm.Fees, Late Fees Fine, SLC fees, Tution Fees",1,2280
SMR02-217-PRINCIPAL,"0202-EDUCATION SPORTS,ARTS & CULTURE",0202-01-102-01-TUITION AND OTHER FEES,30/06/2017,"[H0202000023] HIMGRN:B17F123303, PRINCIPAL GSSS HARIPUR KHOL TUITION AND OTHER FEES -ADMISSION FEES, RE-ADMISSION FEES, TUTION FEES, LATE.ADM FEES.SLC FEES",1,775
SMR02-217-PRINCIPAL,"0202-EDUCATION SPORTS,ARTS & CULTURE",0202-01-102-01-TUITION AND OTHER FEES,20/10/2017,"[L0202000001] HIMGRN:B17I136900, PRY GSSS HARIPUR KHOL TUITION AND OTHER FEES -SLC AND LATE FEES IN R/O GSSS HARIPUR KHOL DISTT.SIRMOUR HP",1,1890
SMR02-217-PRINCIPAL,"0202-EDUCATION SPORTS,ARTS & CULTURE",0202-01-102-01-TUITION AND OTHER FEES,30/10/2017,"[L0202000012] HIMGRN:B17J128679, PRINCIPAL GSSS HARIPUR KHOL TUITION AND OTHER FEES -",1,3600
SMR02-217-PRINCIPAL,"0202-EDUCATION SPORTS,ARTS & CULTURE",0202-01-102-01-TUITION AND OTHER FEES,21/06/2018,"[H0202000007] HIMGRN:B18F110396, PRINCIPAL TUITION AND OTHER FEES -",1,2362
SMR02-217-PRINCIPAL,8011-INSURANCE AND PENSION FUNDS,8011-00-107-01-INSURANCE FUND,05/01/2018,"[C8011000001] HIMGRN:B17L137468, PRINCIPAL HARIPURKHOL SAVING FUND INSURANCE FUND -SF and IF with interest of Sh Amerjeet Singh PGT",1,290
SMR02-217-PRINCIPAL,8011-INSURANCE AND PENSION FUNDS,8011-00-107-02-SAVING FUND,05/01/2018,"[C8011000001] HIMGRN:B17L137468, PRINCIPAL HARIPURKHOL SAVING FUND INSURANCE FUND -SF and IF with interest of Sh Amerjeet Singh PGT",1,476
