DDODesc,MAJOR,RECEIPTHEAD,BOOKDATE,Tenderer,Challan,NETRECEIPT
"SOL00-026-SUPDT.ENGR.3RD CIRCLE, SOLAN",0059-PUBLIC WORKS,0059-60-800-01-OTHER ITEMS,19/06/2018,"[H0059000002] HIMGRN:B18F121307, BHART KUMAR KAPOOR OTHER ITEMS -medical recovry",1,9606
"SOL00-026-SUPDT.ENGR.3RD CIRCLE, SOLAN",1054-ROADS & BRIDGES,1054-00-800-01-RECOVERY OF OVER PAYMENT,26/07/2018,"[I1054000001] HIMGRN:B18G141802, ASHOK GANDOTRA RECOVERY OF OVER PAYMENT -Medical Recoery",1,2337
"SOL00-026-SUPDT.ENGR.3RD CIRCLE, SOLAN",1054-ROADS & BRIDGES,1054-00-800-01-RECOVERY OF OVER PAYMENT,23/08/2018,"[J1054000001] HIMGRN:B18H127071, CHAIN SINGH RECOVERY OF OVER PAYMENT -Medical Recovery",1,165
"SOL00-026-SUPDT.ENGR.3RD CIRCLE, SOLAN",8011-INSURANCE AND PENSION FUNDS,8011-00-107-01-INSURANCE FUND,19/06/2018,"[H8011000012] HIMGRN:B18F121393, JOGINDER SINGH ENGINEER OFFICER SAVING FUND INSURANCE FUND -GIS",1,36
"SOL00-026-SUPDT.ENGR.3RD CIRCLE, SOLAN",8011-INSURANCE AND PENSION FUNDS,8011-00-107-02-SAVING FUND,19/06/2018,"[H8011000012] HIMGRN:B18F121393, JOGINDER SINGH ENGINEER OFFICER SAVING FUND INSURANCE FUND -GIS",1,84
