DDODesc,MAJOR,RECEIPTHEAD,BOOKDATE,Tenderer,Challan,NETRECEIPT
SML09-216-GSSS SANSOG JUBBAL,"0202-EDUCATION SPORTS,ARTS & CULTURE",0202-01-102-01-TUITION AND OTHER FEES,31/10/2017,"[L0202000001] HIMGRN:B17J101185, PRINCIPAL GSSS SANSOG TUITION AND OTHER FEES -",1,285
SML09-216-GSSS SANSOG JUBBAL,"0202-EDUCATION SPORTS,ARTS & CULTURE",0202-01-102-01-TUITION AND OTHER FEES,31/10/2017,"[L0202000002] HIMGRN:B17J101301, PRINCIPAL GSSS SANSOG TUITION AND OTHER FEES -",1,405
SML09-216-GSSS SANSOG JUBBAL,"0202-EDUCATION SPORTS,ARTS & CULTURE",0202-01-102-01-TUITION AND OTHER FEES,31/10/2017,"[L0202000004] HIMGRN:B17J102185, PRINCIPAL GOVT SR SEC SCHOOL SANSOG TUITION AND OTHER FEES -",1,345
SML09-216-GSSS SANSOG JUBBAL,"0202-EDUCATION SPORTS,ARTS & CULTURE",0202-01-102-01-TUITION AND OTHER FEES,31/08/2018,"[J0202000006] HIMGRN:b18h134543, PRINCIPAL TUITION AND OTHER FEES -TUITION AND OTHER FEE",1,1120
SML09-216-GSSS SANSOG JUBBAL,"0202-EDUCATION SPORTS,ARTS & CULTURE",0202-01-600-01-RECOVERIES OF OVER PAYMENT,31/10/2017,"[L0202000003] HIMGRN:B17I102587, PRINCIPAL RECOVERIES OF OVER PAYMENT -One Month Incriment Recovery Smt Rachna PGT (History)",1,690
