DDODesc,MAJOR,RECEIPTHEAD,BOOKDATE,Tenderer,Challan,NETRECEIPT
MDI00-206-PRINCIPAL GSSS SIANJI,"0202-EDUCATION SPORTS,ARTS & CULTURE",0202-01-102-01-TUITION AND OTHER FEES,20/05/2017,"[G0202000110] HIMGRN:B17E122799, PRINCIPAL GSSS SIANJI MANDI HP TUITION AND OTHER FEES -",1,3155
MDI00-206-PRINCIPAL GSSS SIANJI,"0202-EDUCATION SPORTS,ARTS & CULTURE",0202-01-102-01-TUITION AND OTHER FEES,20/06/2017,"[H0202000070] HIMGRN:B17F121690, PRINCIPAL TUITION AND OTHER FEES -",1,496
MDI00-206-PRINCIPAL GSSS SIANJI,"0202-EDUCATION SPORTS,ARTS & CULTURE",0202-01-102-01-TUITION AND OTHER FEES,05/07/2017,"[I0202000012] HIMGRN:B17G104631, PRINCIPAL GSSS SIANJI TUITION AND OTHER FEES -",1,350
MDI00-206-PRINCIPAL GSSS SIANJI,"0202-EDUCATION SPORTS,ARTS & CULTURE",0202-01-600-01-RECOVERIES OF OVER PAYMENT,20/05/2017,"[G0202000109] HIMGRN:B17E133673, PRINCIPAL GSSS SIANJI RECOVERIES OF OVER PAYMENT -",1,250
MDI00-206-PRINCIPAL GSSS SIANJI,"0202-EDUCATION SPORTS,ARTS & CULTURE",0202-01-600-01-RECOVERIES OF OVER PAYMENT,05/07/2017,"[I0202000011] HIMGRN:B17G104938, SH SHYAM LAL AND SH SHARAN DASS RECOVERIES OF OVER PAYMENT -",1,497
