DDODesc,MAJOR,RECEIPTHEAD,BOOKDATE,Tenderer,Challan,NETRECEIPT
SMR08-203-GSSS BOGDHAR,"0202-EDUCATION SPORTS,ARTS & CULTURE",0202-01-101-02-SECONDARY EDUCATION,08/06/2017,"[H0202000004] HIMGRN:B17F101926, AHHOK KUMAR SECONDARY EDUCATION -AD. /SLC/TUITION/LATE AD.-FEE IN R/O GSSS BOGDHAR",1,3320
SMR08-203-GSSS BOGDHAR,"0202-EDUCATION SPORTS,ARTS & CULTURE",0202-01-101-02-SECONDARY EDUCATION,24/10/2017,"[L0202000003] HIMGRN:B17J114609, CHAMAN LAL SECONDARY EDUCATION -",1,4295
SMR08-203-GSSS BOGDHAR,"0202-EDUCATION SPORTS,ARTS & CULTURE",0202-01-102-01-TUITION AND OTHER FEES,08/06/2017,"[H0202000003] HIMGRN:B17F101930, ASHOK KUMAR TUITION AND OTHER FEES -SLC/AD./RE-AD.-FEE etc. in r/0 GHS CHOKAR and GHS TALI",1,627
SMR08-203-GSSS BOGDHAR,"0202-EDUCATION SPORTS,ARTS & CULTURE",0202-01-102-01-TUITION AND OTHER FEES,31/08/2017,"[J0202000004] HIMGRN:B17H135112, HM GMS GATLOG TUITION AND OTHER FEES -",1,890
SMR08-203-GSSS BOGDHAR,"0202-EDUCATION SPORTS,ARTS & CULTURE",0202-01-102-01-TUITION AND OTHER FEES,22/05/2018,"[G0202000007] HIMGRN:B18E134181, PRINCIPAL GSSS BOGDHAR TUITION AND OTHER FEES -TUTION FEE OTHER FEE",1,2935
SMR08-203-GSSS BOGDHAR,"0202-EDUCATION SPORTS,ARTS & CULTURE",0202-01-102-01-TUITION AND OTHER FEES,21/06/2018,"[H0202000005] HIMGRN:B18F118132, PRINCIPAL GSSS BOGDHAR SMR H P TUITION AND OTHER FEES -",1,399
SMR08-203-GSSS BOGDHAR,"0202-EDUCATION SPORTS,ARTS & CULTURE",0202-01-102-01-TUITION AND OTHER FEES,21/07/2018,"[I0202000009] HIMGRN:B18G121634, PRINCIPAL GSSS BOGDHAR TUITION AND OTHER FEES -",1,3500
SMR08-203-GSSS BOGDHAR,"0202-EDUCATION SPORTS,ARTS & CULTURE",0202-01-600-01-RECOVERIES OF OVER PAYMENT,20/06/2017,"[H0202000006] HIMGRN:B17F127052, CHAMAN LAL RECOVERIES OF OVER PAYMENT -IN R/O SH.Jagat Ram Peon w.e.f 1.7.98 to 31.7.2001",1,3700
