DDODesc,MAJOR,RECEIPTHEAD,BOOKDATE,Tenderer,Challan,NETRECEIPT
KNG06-005-C.D.P.O. FATEHPUR,0049-INTEREST RECEIPTS,0049-04-800-13-MISCELLANEOUS,21/03/2018,"[E0049000001] HIMGRN:B18C121996, CDPO FATEHPUR MISCELLANEOUS -Interest amount Rs. 129673 against Account No. 20028010860 of CDPO Fatehpur in Kangra",1,129673
KNG06-005-C.D.P.O. FATEHPUR,0049-INTEREST RECEIPTS,0049-04-800-13-MISCELLANEOUS,31/07/2018,"[I0049000002] HIMGRN:B18G139327, CDPO FATEHPUR MISCELLANEOUS -excess drawal of honr smt leela smt sandesh",1,24750
KNG06-005-C.D.P.O. FATEHPUR,0070-OTHER ADMINISTRATIVE SERVICES,0070-60-800-05-MISCELLANEOUS RECEIPTS,31/07/2018,"[I0070000002] HIMGRN:B18G139379, CDPO FATEHPUR MISCELLANEOUS RECEIPTS -RTI amount received from Sonia Jagdish chand",1,30
KNG06-005-C.D.P.O. FATEHPUR,0235-SOCIAL SECURITY & WELFARE,0235-01-800-03-RECEIPTS FROM SCHEMES OF WELFARE DEPTT.,31/07/2018,"[I0235000001] HIMGRN:B18G139402, CDPO FATEHPUR RECEIPTS FROM SCHEMES OF WELFARE DEPTT -Interest received from this office account no KCCB Fatehpur",1,62966
KNG06-005-C.D.P.O. FATEHPUR,0235-SOCIAL SECURITY & WELFARE,0235-60-105-02-INDEX PERSONAL INSURANCE ACCIDENT SCHEME FOR GOVT. EMPLOYEES.,21/03/2018,"[E0235000001] HIMGRN:B18C122563, CDPO FATEHPUR INDEX PERSONAL INSURANCE ACCIDENT SCHEME FOR GOVT EMP -Insurance fund of three daily wagers Sh Ganes",1,240
