DDODesc,MAJOR,RECEIPTHEAD,BOOKDATE,Tenderer,Challan,NETRECEIPT
KLU01-208-GSSS BATHAD,"0202-EDUCATION SPORTS,ARTS & CULTURE",0202-01-102-01-TUITION AND OTHER FEES,31/05/2017,"[G0202000014] HIMGRN:B17E132604, PRSSS BATHAD TUITION AND OTHER FEES -",1,714
KLU01-208-GSSS BATHAD,"0202-EDUCATION SPORTS,ARTS & CULTURE",0202-01-102-01-TUITION AND OTHER FEES,31/05/2017,"[G0202000022] HIMGRN:B17E152172, PR S S S BATHAD TUITION AND OTHER FEES -",1,4498
KLU01-208-GSSS BATHAD,"0202-EDUCATION SPORTS,ARTS & CULTURE",0202-01-102-01-TUITION AND OTHER FEES,19/07/2017,"[I0202000005] HIMGRN:B17G125387, PRINCIPAL GSSS BATHAD TUITION AND OTHER FEES -tution fee and other fee",1,191
KLU01-208-GSSS BATHAD,"0202-EDUCATION SPORTS,ARTS & CULTURE",0202-01-102-01-TUITION AND OTHER FEES,20/06/2018,"[H0202000009] HIMGRN:B18F119839, PRINCIPLE GSSS BATHAD TUITION AND OTHER FEES -ad fee and tution fee",1,3350
KLU01-208-GSSS BATHAD,"0202-EDUCATION SPORTS,ARTS & CULTURE",0202-01-600-03-MISCELLANEOUS RECEIPTS,30/06/2018,"[H0202000019] HIMGRN:B18F138996, PRINCIPAL GSSS BATHAD MISCELLANEOUS RECEIPTS -ad. fee./SlC",1,824
