DDODesc,MAJOR,RECEIPTHEAD,BOOKDATE,Tenderer,Challan,NETRECEIPT
KNG10-518-TEHSILDAR ELECTION KANGRA,0070-OTHER ADMINISTRATIVE SERVICES,0070-02-101-01-SALE PROCEED OF ELECTION FORMS AND DOCUMENTS BY ELECTION DEPARTMENT,31/05/2017,"[G0070000001] HIMGRN:B17D175934, SDM JAISINGHPUR SALE PROCEED OF ELECTION FORMS AND DOCUMENTS BY ELECTION DEPARTMENT -",1,2385
KNG10-518-TEHSILDAR ELECTION KANGRA,0070-OTHER ADMINISTRATIVE SERVICES,0070-02-104-01-FEES FINE FOREFEATURES BY ELECTION DEPTT,30/01/2018,"[C0070000001] HIMGRN:B18A126852, ERO SDM JAISINGHPUR FEES FINE FOREFEATURES BY ELECTION DEPTT -ERO SDM JAISINGHPUR",1,15000
KNG10-518-TEHSILDAR ELECTION KANGRA,0070-OTHER ADMINISTRATIVE SERVICES,0070-02-104-01-FEES FINE FOREFEATURES BY ELECTION DEPTT,09/02/2018,"[D0070000001] HIMGRN:B18B103233, ERO SDM JAISINGHPUR FEES FINE FOREFEATURES BY ELECTION DEPTT -",1,700
KNG10-518-TEHSILDAR ELECTION KANGRA,0070-OTHER ADMINISTRATIVE SERVICES,0070-02-104-01-FEES FINE FOREFEATURES BY ELECTION DEPTT,11/06/2018,"[H0070000001] HIMGRN:B18F108952, ERO CUM SDM JAISINGHPUR FEES FINE FOREFEATURES BY ELECTION DEPTT -",1,400
KNG10-518-TEHSILDAR ELECTION KANGRA,0070-OTHER ADMINISTRATIVE SERVICES,0070-02-104-01-FEES FINE FOREFEATURES BY ELECTION DEPTT,16/07/2018,"[I0070000001] HIMGRN:B18G107385, ERO CUM SDM JAISINGHPUR FEES FINE FOREFEATURES BY ELECTION DEPTT -",1,550
KNG10-518-TEHSILDAR ELECTION KANGRA,0070-OTHER ADMINISTRATIVE SERVICES,0070-02-104-01-FEES FINE FOREFEATURES BY ELECTION DEPTT,24/08/2018,"[J0070000001] HIMGRN:B18H107606, ERO CUM SDM JAIISINGHPUR FEES FINE FOREFEATURES BY ELECTION DEPTT -",1,350
KNG10-518-TEHSILDAR ELECTION KANGRA,0070-OTHER ADMINISTRATIVE SERVICES,0070-02-104-02-FEES FINES FOREFEITURES BY STATE ELECTION COMMISSION,24/05/2018,"[G0070000001] HIMGRN:B18E108491, ERO CUM SDM JAISINGHPUR FEES FINES FOREFEITURES BY STATE ELECTION COMMISSION -Nil",1,800
