DDODesc,MAJOR,RECEIPTHEAD,BOOKDATE,Tenderer,Challan,NETRECEIPT
KNR04-209-GHS RAMNI,"0202-EDUCATION SPORTS,ARTS & CULTURE",0202-01-102-01-TUITION AND OTHER FEES,31/05/2017,"[G0202000003] HIMGRN:B17E131676, HEADMASTER TUITION AND OTHER FEES -Admission Fee and SLC of 9th and 10th classes",1,190
KNR04-209-GHS RAMNI,"0202-EDUCATION SPORTS,ARTS & CULTURE",0202-01-102-01-TUITION AND OTHER FEES,09/08/2018,"[J0202000002] HIMGRN:B18H101384, HM GHS RAMNI TUITION AND OTHER FEES -SLC for 2018-19",1,80
KNR04-209-GHS RAMNI,"0202-EDUCATION SPORTS,ARTS & CULTURE",0202-01-600-01-RECOVERIES OF OVER PAYMENT,21/05/2018,"[G0202000005] HIMGRN:B18E126222, HM GHS RAMNI RECOVERIES OF OVER PAYMENT -over drawl of May 2016 IR in r/o Sh. Tashi Gailchhan HM GHS Ramni",1,400
KNR04-209-GHS RAMNI,8011-INSURANCE AND PENSION FUNDS,8011-00-107-01-INSURANCE FUND,21/06/2018,"[H8011000006] HIMGRN:B18F111257, HM GHS RAMNI SAVING FUND INSURANCE FUND -Missing premium of GIS in r/o Late Sh. Dalip Singh Peon GMS Jani Kinnaur",1,5
KNR04-209-GHS RAMNI,8011-INSURANCE AND PENSION FUNDS,8011-00-107-02-SAVING FUND,21/06/2018,"[H8011000006] HIMGRN:B18F111257, HM GHS RAMNI SAVING FUND INSURANCE FUND -Missing premium of GIS in r/o Late Sh. Dalip Singh Peon GMS Jani Kinnaur",1,10
