DDODesc,MAJOR,RECEIPTHEAD,BOOKDATE,Tenderer,Challan,NETRECEIPT
HMR02-224-HM GHS KOHLA,"0202-EDUCATION SPORTS,ARTS & CULTURE",0202-01-102-01-TUITION AND OTHER FEES,22/05/2017,"[G0202000015] HIMGRN:B17E123297, HM GHS KOHLA TUITION AND OTHER FEES -",1,175
HMR02-224-HM GHS KOHLA,"0202-EDUCATION SPORTS,ARTS & CULTURE",0202-01-102-01-TUITION AND OTHER FEES,20/06/2017,"[H0202000007] HIMGRN:B17F124066, HEADMISTRESS GHS KOHLA TUITION AND OTHER FEES -",1,25
HMR02-224-HM GHS KOHLA,"0202-EDUCATION SPORTS,ARTS & CULTURE",0202-01-102-01-TUITION AND OTHER FEES,27/04/2018,"[F0202000023] HIMGRN:B18D173387, HEADMASTER TUITION AND OTHER FEES -",1,40
HMR02-224-HM GHS KOHLA,"0202-EDUCATION SPORTS,ARTS & CULTURE",0202-01-102-01-TUITION AND OTHER FEES,29/05/2018,"[G0202000030] HIMGRN:B18E143764, HEADMASTER TUITION AND OTHER FEES -ADMISSION FEES OF 9TH AND 10 CLASS OF GHS KOHLA",1,145
HMR02-224-HM GHS KOHLA,8009-STATE PROVIDENT FUNDS,8009-01-101-01-ADVANCES,31/03/2018,"[E8009000001] HIMGRN:B18C149922, LATA PATHANIA HEADMISTRESS ADVANCES -",1,59590
