DDODesc,MAJOR,RECEIPTHEAD,BOOKDATE,Tenderer,Challan,NETRECEIPT
MDI12-243-HM GHS NALYANA,"0202-EDUCATION SPORTS,ARTS & CULTURE",0202-01-102-01-TUITION AND OTHER FEES,22/05/2017,"[G0202000007] HIMGRN:B17E110910, HEADMASTER GHS NALYANA TUITION AND OTHER FEES -",1,75
MDI12-243-HM GHS NALYANA,"0202-EDUCATION SPORTS,ARTS & CULTURE",0202-01-102-01-TUITION AND OTHER FEES,22/06/2017,"[H0202000013] HIMGRN:B17F113206, HEADMASTER TUITION AND OTHER FEES -addmission fee",1,5
MDI12-243-HM GHS NALYANA,"0202-EDUCATION SPORTS,ARTS & CULTURE",0202-01-102-01-TUITION AND OTHER FEES,31/05/2018,"[G0202000026] HIMGRN:B18E132920, HEADMASTER TUITION AND OTHER FEES -",1,90
MDI12-243-HM GHS NALYANA,"0202-EDUCATION SPORTS,ARTS & CULTURE",0202-01-102-03-MISCELLANEOUS RECEIPTS,22/05/2017,"[G0202000008] HIMGRN:B17E110965, RATTAN CHAND RETD DM MISCELLANEOUS RECEIPTS -",1,7503
MDI12-243-HM GHS NALYANA,8449-OTHER DEPOSITS,8449-00-120-00- ,31/05/2017,"[G8449000001] HIMGRN:B17E138322, HEADMASTER MISCELLANEOUS DEPOSITS -Income from property auction",1,105
