DDODesc,MAJOR,RECEIPTHEAD,BOOKDATE,Tenderer,Challan,NETRECEIPT
KNG00-038-DY DIR INFORMATION & PUBLIC RELATION DHARAMSHALA,0070-OTHER ADMINISTRATIVE SERVICES,0070-60-118-01-RECEIPT FROM RIGHT TO INFORMATION ACT,09/10/2017,"[L0070000043] HIMGRN:B17J110402, DDPR DHARAMSHALA RECEIPT FROM RIGHT TO INFORMATION ACT -Amount received under RTI Act 2005 from Sh Ravinder Aggarwal",1,20
KNG00-038-DY DIR INFORMATION & PUBLIC RELATION DHARAMSHALA,0070-OTHER ADMINISTRATIVE SERVICES,0070-60-118-01-RECEIPT FROM RIGHT TO INFORMATION ACT,25/06/2018,"[H0070000239] HIMGRN:B18F136289, VIPIN KOUNDAL ADVOCATE RECEIPT FROM RIGHT TO INFORMATION ACT -RTI Fee",1,20
KNG00-038-DY DIR INFORMATION & PUBLIC RELATION DHARAMSHALA,0220-INFORMATION & PUBLICITY,0220-60-800-01-OTHER RECEIPTS.,31/05/2017,"[G0220000001] HIMGRN:B17E151850, DEPUTY DIRECTOR PUBLIC RELATIONS OTHER RECEIPTS -Auction of old newspapers and magazines w.e.f. 01-04-2016 to 31-03-2017",1,2550
KNG00-038-DY DIR INFORMATION & PUBLIC RELATION DHARAMSHALA,0220-INFORMATION & PUBLICITY,0220-60-800-01-OTHER RECEIPTS.,02/05/2018,"[G0220000001] HIMGRN:B18E103857, DEPUTY DIRECTOR OTHER RECEIPTS -Auction of Old Newspapers and Magazines",1,2580
KNG00-038-DY DIR INFORMATION & PUBLIC RELATION DHARAMSHALA,0220-INFORMATION & PUBLICITY,0220-60-800-01-OTHER RECEIPTS.,15/05/2018,"[G0220000002] HIMGRN:B18E109530, DEPUTY DIRECTOR PUBLIC RELATIONS OTHER RECEIPTS -Security returned in respect of Temporary telephone connection during winter session",1,535
