DDODesc,MAJOR,RECEIPTHEAD,BOOKDATE,Tenderer,Challan,NETRECEIPT
BLP01-203-GSSS BEHAL,0075-MISCELLANEOUS GENERAL SERVICES,0075-00-800-02-SALE OF OLD STORES & MATERIAL,19/08/2017,"[J0075000001] HIMGRN:B17H101120, PRINCIPAL GSSS BEHAL SALE OF OLD STORES AND MATERIAL -",1,650
BLP01-203-GSSS BEHAL,"0202-EDUCATION SPORTS,ARTS & CULTURE",0202-01-102-01-TUITION AND OTHER FEES,19/06/2017,"[H0202000001] HIMGRN:B17F114251, PRINCIPAL BEHAL BLP TUITION AND OTHER FEES -",1,7415
BLP01-203-GSSS BEHAL,"0202-EDUCATION SPORTS,ARTS & CULTURE",0202-01-102-01-TUITION AND OTHER FEES,21/10/2017,"[L0202000004] HIMGRN:B17J115804, PRINCIPAL BEHAL TUITION AND OTHER FEES -",1,9325
BLP01-203-GSSS BEHAL,"0202-EDUCATION SPORTS,ARTS & CULTURE",0202-01-102-01-TUITION AND OTHER FEES,22/03/2018,"[E0202000003] HIMGRN:b18c118516, PRINCIPAL GSSS BEHAL TUITION AND OTHER FEES -",1,4415
BLP01-203-GSSS BEHAL,"0202-EDUCATION SPORTS,ARTS & CULTURE",0202-01-102-01-TUITION AND OTHER FEES,26/06/2018,"[H0202000005] HIMGRN:B18F109776, PRINCIPAL BEHAL TUITION AND OTHER FEES -",1,6875
BLP01-203-GSSS BEHAL,"0202-EDUCATION SPORTS,ARTS & CULTURE",0202-01-102-01-TUITION AND OTHER FEES,27/08/2018,"[J0202000003] HIMGRN:B18H102867, GSSS BEHAL TUITION AND OTHER FEES -",1,7475
