DDODesc,MAJOR,RECEIPTHEAD,BOOKDATE,Tenderer,Challan,NETRECEIPT
KLU01-001-B.D.O. BANJAR,0049-INTEREST RECEIPTS,0049-04-800-07-INTEREST ON LOANS UNDER LIGH SCHEME,30/06/2017,"[H0049000001] HIMGRN:B17F139759, JAWALA DASS INTEREST ON LOANS UNDER LIG HOUSING SCHEME -",1,1899
KLU01-001-B.D.O. BANJAR,0049-INTEREST RECEIPTS,0049-04-800-07-INTEREST ON LOANS UNDER LIGH SCHEME,23/08/2017,"[J0049000001] HIMGRN:B17H105047, GHANSHAYAM SINGH INTEREST ON LOANS UNDER LIG HOUSING SCHEME -INTEREST",1,2150
KLU01-001-B.D.O. BANJAR,0515-OTHER RURAL DEVELOPMENT PROGRAMMES,0515-00-800-03-MISC.RECEIPT FROM RDD.,30/06/2017,"[H0515000001] HIMGRN:B17F140098, JAWALA DASS MISC.RECEIPT FROM RDD. -",1,528
KLU01-001-B.D.O. BANJAR,0515-OTHER RURAL DEVELOPMENT PROGRAMMES,0515-00-800-03-MISC.RECEIPT FROM RDD.,23/08/2017,"[J0515000001] HIMGRN:B17H105001, GHANSHAYAM SINGH MISC.RECEIPT FROM RDD. -",1,2400
KLU01-001-B.D.O. BANJAR,0515-OTHER RURAL DEVELOPMENT PROGRAMMES,0515-00-800-03-MISC.RECEIPT FROM RDD.,31/10/2017,"[L0515000001] HIMGRN:B17J139509, TULE RAM RETD SUPDT MISC.RECEIPT FROM RDD. -Medical Reimbursement bill of Sh. Tule Ram",1,26050
KLU01-001-B.D.O. BANJAR,"7610-LOANS TO GOVERNMENT SERVANTS , ETC.",7610-00-800-04-Education Loan,31/05/2017,"[G7610000001] HIMGRN:B17E132262, BELI RAM VERMA EDUCATION LOAN -",1,1250
