DDODesc,MAJOR,RECEIPTHEAD,BOOKDATE,Tenderer,Challan,NETRECEIPT
MDI00-209-GSSS  KATINDI,"0202-EDUCATION SPORTS,ARTS & CULTURE",0202-01-102-01-TUITION AND OTHER FEES,21/04/2017,"[F0202000019] HIMGRN:B17D150280, PRINCIPAL GSSS KATINDHI TUITION AND OTHER FEES -Tuition Fees Ad Fees",1,2670
MDI00-209-GSSS  KATINDI,"0202-EDUCATION SPORTS,ARTS & CULTURE",0202-01-102-01-TUITION AND OTHER FEES,24/05/2017,"[G0202000208] HIMGRN:B17E138723, PRINCIPAL TUITION AND OTHER FEES -Tuition and other fees",1,371
MDI00-209-GSSS  KATINDI,"0202-EDUCATION SPORTS,ARTS & CULTURE",0202-01-102-01-TUITION AND OTHER FEES,29/06/2017,"[H0202000180] HIMGRN:B17F141311, PRINCIPAL TUITION AND OTHER FEES -Tuition and other fees",1,220
MDI00-209-GSSS  KATINDI,"0202-EDUCATION SPORTS,ARTS & CULTURE",0202-01-102-01-TUITION AND OTHER FEES,18/08/2017,"[J0202000044] HIMGRN:B17H121569, PRINCIPAL GSSS KATINDHI DISTT MANDI HP TUITION AND OTHER FEES -Tuition and other fees",1,5405
MDI00-209-GSSS  KATINDI,"0202-EDUCATION SPORTS,ARTS & CULTURE",0202-01-102-01-TUITION AND OTHER FEES,07/06/2018,"[H0202000007] HIMGRN:B18F110607, PRINCIPAL TUITION AND OTHER FEES -",1,260
MDI00-209-GSSS  KATINDI,"0202-EDUCATION SPORTS,ARTS & CULTURE",0202-01-102-01-TUITION AND OTHER FEES,29/08/2018,"[J0202000158] HIMGRN:B18H133976, PRINCIPAL GSSS KATINDHI DISTT MANDI (HP) TUITION AND OTHER FEES -Tuition and Ohters Fees",1,5265
MDI00-209-GSSS  KATINDI,"0202-EDUCATION SPORTS,ARTS & CULTURE",0202-01-600-01-RECOVERIES OF OVER PAYMENT,11/04/2018,"[F0202000019] HIMGRN:B18D125446, PRINCIPAL RECOVERIES OF OVER PAYMENT -SLC",1,30
MDI00-209-GSSS  KATINDI,"0202-EDUCATION SPORTS,ARTS & CULTURE",0202-01-600-01-RECOVERIES OF OVER PAYMENT,11/04/2018,"[F0202000021] HIMGRN:B18D125450, PRINCIPAL RECOVERIES OF OVER PAYMENT -Recovery of over payment Smt.Savatri Devi",1,42023
MDI00-209-GSSS  KATINDI,"0202-EDUCATION SPORTS,ARTS & CULTURE",0202-04-102-01-PUBLIC LIBRARY,01/11/2017,"[M0202000003] HIMGRN:B17J138117, PRINCIPAL GSSS KATINDHI PUBLIC LIBRARY -Public Libraries",1,2041
