DDODesc,MAJOR,RECEIPTHEAD,BOOKDATE,Tenderer,Challan,NETRECEIPT
KNG01-023-ASSTT.DISTT.ATTORNEY KANGRA,0070-OTHER ADMINISTRATIVE SERVICES,0070-60-800-05-MISCELLANEOUS RECEIPTS,31/10/2017,"[L0070000018] HIMGRN:B17J142495, SUNIT KOHLI MISCELLANEOUS RECEIPTS -renewl fees",1,1000
KNG01-023-ASSTT.DISTT.ATTORNEY KANGRA,0070-OTHER ADMINISTRATIVE SERVICES,0070-60-800-05-MISCELLANEOUS RECEIPTS,30/01/2018,"[C0070000017] HIMGRN:B18A140139, YASHPAL KACHROO MISCELLANEOUS RECEIPTS -",1,1000
KNG01-023-ASSTT.DISTT.ATTORNEY KANGRA,0070-OTHER ADMINISTRATIVE SERVICES,0070-60-800-05-MISCELLANEOUS RECEIPTS,28/02/2018,"[D0070000012] HIMGRN:B18B135790, NAVEEN KUMAR SAINI MISCELLANEOUS RECEIPTS -RENEWAL FEES",1,1000
KNG01-023-ASSTT.DISTT.ATTORNEY KANGRA,0070-OTHER ADMINISTRATIVE SERVICES,0070-60-800-05-MISCELLANEOUS RECEIPTS,19/03/2018,"[E0070000003] HIMGRN:B18C106583, ADA KANGRA MISCELLANEOUS RECEIPTS -Cost received in civil suit titled as Shiv Shakti Oil Mills Vs State H.P.",1,250
KNG01-023-ASSTT.DISTT.ATTORNEY KANGRA,0070-OTHER ADMINISTRATIVE SERVICES,0070-60-800-05-MISCELLANEOUS RECEIPTS,19/03/2018,"[E0070000004] HIMGRN:B18C106519, ADA KANGRA MISCELLANEOUS RECEIPTS -Cost received in civil suit titled as Ganesh oil Mills Vs State of H.P.",1,250
KNG01-023-ASSTT.DISTT.ATTORNEY KANGRA,0070-OTHER ADMINISTRATIVE SERVICES,0070-60-800-05-MISCELLANEOUS RECEIPTS,19/03/2018,"[E0070000005] HIMGRN:B18C106653, ADA KANGRA MISCELLANEOUS RECEIPTS -Cost received in civil suit Victory Oil Udyog Vs State of H.P.",1,250
KNG01-023-ASSTT.DISTT.ATTORNEY KANGRA,0070-OTHER ADMINISTRATIVE SERVICES,0070-60-800-05-MISCELLANEOUS RECEIPTS,27/04/2018,"[F0070000022] HIMGRN:B18D168753, AVTAR SINGH MISCELLANEOUS RECEIPTS -",1,1000
KNG01-023-ASSTT.DISTT.ATTORNEY KANGRA,0070-OTHER ADMINISTRATIVE SERVICES,0070-60-800-05-MISCELLANEOUS RECEIPTS,16/07/2018,"[I0070000007] HIMGRN:B18G103901, ADV SURESH CHAND DHANOTIA MISCELLANEOUS RECEIPTS -RENEWAL FEES",1,1000
KNG01-023-ASSTT.DISTT.ATTORNEY KANGRA,0070-OTHER ADMINISTRATIVE SERVICES,0070-60-800-05-MISCELLANEOUS RECEIPTS,31/07/2018,"[I0070000023] HIMGRN:B18G135139, ASSISTANT DISTRICT ATTORNEY KANGRA MISCELLANEOUS RECEIPTS -",1,500
