DDODesc,MAJOR,RECEIPTHEAD,BOOKDATE,Tenderer,Challan,NETRECEIPT
KNG06-953-DIRECTOR (FISHRIES),0405-FISHERIES,0405-00-102-01-RECEIPT FROM LICENCE FEES FINES ETC,21/03/2018,"[E0405000005] HIMGRN:B18C113458, FISHERIES OFFICER KHATIAR RECEIPT FROM LICENCE FEES FINES ETC -",1,1240
KNG06-953-DIRECTOR (FISHRIES),0405-FISHERIES,0405-00-102-01-RECEIPT FROM LICENCE FEES FINES ETC,30/06/2018,"[H0405000005] HIMGRN:B18F143839, FISHERIES OFFICER SATHANA RECEIPT FROM LICENCE FEES FINES ETC -",1,4300
KNG06-953-DIRECTOR (FISHRIES),0405-FISHERIES,0405-00-103-02-ROYALTY ON SALE OF FISH,20/12/2017,"[N0405000002] HIMGRN:B17L108688, FISHERIES OFFICER SATHANA ROYALTY ON SALE OF FISH -",1,5000
KNG06-953-DIRECTOR (FISHRIES),0405-FISHERIES,0405-00-103-02-ROYALTY ON SALE OF FISH,31/05/2018,"[G0405000017] HIMGRN:B18E132170, FISHERIES OFFICER SATHANA ROYALTY ON SALE OF FISH -",1,10000
KNG06-953-DIRECTOR (FISHRIES),0405-FISHERIES,0405-00-800-01-MISCELLANEOUS RECEIPTS FROM FISHERIES,31/05/2017,"[G0405000019] HIMGRN:B17E138604, ASSTT DIRECTOR FISHIRIES MISCELLANEOUS RECEIPTS FROM FISHERIES -Miscellaneous receipts from fisheries recovery of over paymen",1,1440
