DDODesc,MAJOR,RECEIPTHEAD,BOOKDATE,Tenderer,Challan,NETRECEIPT
SML10-208-PR SSS DHAR-GAURA,0070-OTHER ADMINISTRATIVE SERVICES,0070-60-800-05-MISCELLANEOUS RECEIPTS,30/06/2017,"[H0070000030] HIMGRN:B17E138055, PRINCIPAL MISCELLANEOUS RECEIPTS -",1,718
SML10-208-PR SSS DHAR-GAURA,"0202-EDUCATION SPORTS,ARTS & CULTURE",0202-01-102-01-TUITION AND OTHER FEES,31/05/2017,"[G0202000006] HIMGRN:B17E108778, GOVT SR SEC SCHOOL DHAR GAURA TUITION AND OTHER FEES -",1,3471
SML10-208-PR SSS DHAR-GAURA,"0202-EDUCATION SPORTS,ARTS & CULTURE",0202-01-102-01-TUITION AND OTHER FEES,31/08/2017,"[J0202000008] HIMGRN:B17H105629, PRINCIPAL GSSS DHAR GAURA TUITION AND OTHER FEES -",1,2140
SML10-208-PR SSS DHAR-GAURA,"0202-EDUCATION SPORTS,ARTS & CULTURE",0202-01-102-01-TUITION AND OTHER FEES,30/11/2017,"[M0202000006] HIMGRN:B17K103905, PRINCIPAL OF GSSS DHAR GAURA TUITION AND OTHER FEES -",1,3080
SML10-208-PR SSS DHAR-GAURA,"0202-EDUCATION SPORTS,ARTS & CULTURE",0202-01-102-01-TUITION AND OTHER FEES,29/05/2018,"[G0202000018] HIMGRN:B18E119246, PRINCIPAL OF GSSS DHAR GAURA TUITION AND OTHER FEES -",1,5887
SML10-208-PR SSS DHAR-GAURA,"0202-EDUCATION SPORTS,ARTS & CULTURE",0202-01-102-01-TUITION AND OTHER FEES,31/08/2018,"[J0202000006] HIMGRN:B18H115403, PRINCIPAL GSSS DHARGAURA TUITION AND OTHER FEES -",1,2900
SML10-208-PR SSS DHAR-GAURA,"0202-EDUCATION SPORTS,ARTS & CULTURE",0202-01-600-01-RECOVERIES OF OVER PAYMENT,31/05/2017,"[G0202000005] HIMGRN:B17E108702, GOVT SR SEC SCHOOL DHAR GAURA RECOVERIES OF OVER PAYMENT -",1,1063
SML10-208-PR SSS DHAR-GAURA,8011-INSURANCE AND PENSION FUNDS,8011-00-107-01-INSURANCE FUND,31/07/2017,"[I8011000003] HIMGRN:B17G127581, PRINCIPAL DHAR GAURA SAVING FUND INSURANCE FUND -gis schem membership pending subscription",1,75
SML10-208-PR SSS DHAR-GAURA,8011-INSURANCE AND PENSION FUNDS,8011-00-107-02-SAVING FUND,31/07/2017,"[I8011000003] HIMGRN:B17G127581, PRINCIPAL DHAR GAURA SAVING FUND INSURANCE FUND -gis schem membership pending subscription",1,150
