DDODesc,MAJOR,RECEIPTHEAD,BOOKDATE,Tenderer,Challan,NETRECEIPT
CHM06-214-PRINCIPAL ITI GARNOTA,"0202-EDUCATION SPORTS,ARTS & CULTURE",0202-02-101-01-TUTION FEES,28/02/2018,"[D0202000006] HIMGRN:b18b133439, PRINCIPAL GOVT ITI GARNOTA TUTION FEES -Tuition Fee = 55200",1,55200
CHM06-214-PRINCIPAL ITI GARNOTA,0230-LABOUR & EMPLOYMENT,0230-00-800-08-OTHER MISC.RECEIPTS- TECHNICAL EDUCATION,31/10/2017,"[L0230000001] HIMGRN:B17J105915, PRINCIPAL GOVT ITI GARNOTA OTHER MISC.RECEIPTS- TECHNICAL EDUCATION -",1,2000
CHM06-214-PRINCIPAL ITI GARNOTA,0230-LABOUR & EMPLOYMENT,0230-00-800-08-OTHER MISC.RECEIPTS- TECHNICAL EDUCATION,30/11/2017,"[M0230000001] HIMGRN:B17K124213, PRINCIPAL GOVT ITI GARNOTA OTHER MISC.RECEIPTS- TECHNICAL EDUCATION -Tution Fee = 9400/-",1,9400
CHM06-214-PRINCIPAL ITI GARNOTA,0230-LABOUR & EMPLOYMENT,0230-00-800-08-OTHER MISC.RECEIPTS- TECHNICAL EDUCATION,30/11/2017,"[M0230000002] HIMGRN:B17K124694, PRINCIPAL ITI GARNOTA OTHER MISC.RECEIPTS- TECHNICAL EDUCATION -admission fee/tuition fee",1,71400
CHM06-214-PRINCIPAL ITI GARNOTA,0235-SOCIAL SECURITY & WELFARE,0235-60-105-02-INDEX PERSONAL INSURANCE ACCIDENT SCHEME FOR GOVT. EMPLOYEES.,30/12/2017,"[N0235000002] HIMGRN:B17L123983, PRINCIPAL GOVT ITI GARNOTA INDEX PERSONAL INSURANCE ACCIDENT SCHEME FOR GOVT EMP -Sh. Monu ITI Garnota Employees Insurance Sche",1,80
