DDODesc,MAJOR,RECEIPTHEAD,BOOKDATE,Tenderer,Challan,NETRECEIPT
SML02-210-GSSS  KHANETI,"0202-EDUCATION SPORTS,ARTS & CULTURE",0202-01-102-01-TUITION AND OTHER FEES,31/05/2017,"[G0202000003] HIMGRN:B17E112873, PGSSS DEORI KHANETI TUITION AND OTHER FEES -Adm fee, Tution fee, Slc 10th,+1,+2.",1,1390
SML02-210-GSSS  KHANETI,"0202-EDUCATION SPORTS,ARTS & CULTURE",0202-01-102-01-TUITION AND OTHER FEES,30/06/2017,"[H0202000004] HIMGRN:B17F131159, PRINCIPAL GSSS D KHANETI TUITION AND OTHER FEES -",1,150
SML02-210-GSSS  KHANETI,"0202-EDUCATION SPORTS,ARTS & CULTURE",0202-01-102-01-TUITION AND OTHER FEES,29/09/2017,"[K0202000001] HIMGRN:B17I114441, PRINCIPAL GSSS DEORI KHANETI TUITION AND OTHER FEES -",1,2300
SML02-210-GSSS  KHANETI,"0202-EDUCATION SPORTS,ARTS & CULTURE",0202-01-102-01-TUITION AND OTHER FEES,27/04/2018,"[F0202000003] HIMGRN:B18D115902, PRINCIPAL TUITION AND OTHER FEES -",1,280
SML02-210-GSSS  KHANETI,"0202-EDUCATION SPORTS,ARTS & CULTURE",0202-01-102-01-TUITION AND OTHER FEES,27/04/2018,"[F0202000008] HIMGRN:B18D143376, PRINCIPAL GSSS DEORI KHANETI TUITION AND OTHER FEES -",1,685
SML02-210-GSSS  KHANETI,"0202-EDUCATION SPORTS,ARTS & CULTURE",0202-01-102-01-TUITION AND OTHER FEES,29/05/2018,"[G0202000016] HIMGRN:B18E126847, PRINCIPAL TUITION AND OTHER FEES -",1,155
SML02-210-GSSS  KHANETI,"0202-EDUCATION SPORTS,ARTS & CULTURE",0202-01-600-01-RECOVERIES OF OVER PAYMENT,30/06/2018,"[H0202000004] HIMGRN:B18F107663, PRINCIPAL RECOVERIES OF OVER PAYMENT -M R Recovery in r/o Sh Ratesh Chauhan PET GMS Badruni voucher no 2443 dt",1,1134
