DDODesc,MAJOR,RECEIPTHEAD,BOOKDATE,Tenderer,Challan,NETRECEIPT
UNA00-950-CHIEF ELECTRICAL INSPECTOR,0043-TAXES & DUTIES ON ELECTRICITY,0043-00-102-01-RECEIPT UNDER THE INDIAN ELECTRICITY RULE,12/04/2017,"[F0043000002] HIMGRN:B17D132906, MOUNT CARMEL SCHOOL RECEIPT UNDER THE INDIAN ELECTRICITY RULE -",1,1100
UNA00-950-CHIEF ELECTRICAL INSPECTOR,0043-TAXES & DUTIES ON ELECTRICITY,0043-00-102-01-RECEIPT UNDER THE INDIAN ELECTRICITY RULE,12/04/2017,"[F0043000003] HIMGRN:B17D133028, SHIV KATHA UDYOG RECEIPT UNDER THE INDIAN ELECTRICITY RULE -",1,1100
UNA00-950-CHIEF ELECTRICAL INSPECTOR,0043-TAXES & DUTIES ON ELECTRICITY,0043-00-102-01-RECEIPT UNDER THE INDIAN ELECTRICITY RULE,12/04/2017,"[F0043000004] HIMGRN:B17D132993, RAIZADA RESORTS RECEIPT UNDER THE INDIAN ELECTRICITY RULE -",1,1100
UNA00-950-CHIEF ELECTRICAL INSPECTOR,0043-TAXES & DUTIES ON ELECTRICITY,0043-00-102-01-RECEIPT UNDER THE INDIAN ELECTRICITY RULE,12/04/2017,"[F0043000005] HIMGRN:B17D132942, KANWAR HOSPITAL RECEIPT UNDER THE INDIAN ELECTRICITY RULE -",1,1100
UNA00-950-CHIEF ELECTRICAL INSPECTOR,0043-TAXES & DUTIES ON ELECTRICITY,0043-00-102-01-RECEIPT UNDER THE INDIAN ELECTRICITY RULE,12/04/2017,[F0043000006] AE ELECTRICAL SUB DIVISION HPSEB FEE,1,200
UNA00-950-CHIEF ELECTRICAL INSPECTOR,0043-TAXES & DUTIES ON ELECTRICITY,0043-00-102-01-RECEIPT UNDER THE INDIAN ELECTRICITY RULE,26/04/2017,"[F0043000024] HIMGRN:B17D165998, RAHUL KUMAR S/O SH. GURU DUTT RECEIPT UNDER THE INDIAN ELECTRICITY RULE -Inspection fee for 100 KVA sub station and HT line",1,690
UNA00-950-CHIEF ELECTRICAL INSPECTOR,0043-TAXES & DUTIES ON ELECTRICITY,0043-00-102-01-RECEIPT UNDER THE INDIAN ELECTRICITY RULE,04/05/2017,"[G0043000002] HIMGRN:B17E109169, IMMUNTIC LIFE SCIENCE RECEIPT UNDER THE INDIAN ELECTRICITY RULE -fee for inspection of DG Set",1,500
UNA00-950-CHIEF ELECTRICAL INSPECTOR,0043-TAXES & DUTIES ON ELECTRICITY,0043-00-102-01-RECEIPT UNDER THE INDIAN ELECTRICITY RULE,18/05/2017,"[G0043000004] HIMGRN:B17E128828, ASSISTANT ENGINEER RECEIPT UNDER THE INDIAN ELECTRICITY RULE -EI fee for SOP to 40BHP MC of Seed grading plant at villa",1,600
UNA00-950-CHIEF ELECTRICAL INSPECTOR,0043-TAXES & DUTIES ON ELECTRICITY,0043-00-102-01-RECEIPT UNDER THE INDIAN ELECTRICITY RULE,18/05/2017,"[G0043000005] HIMGRN:B17E128848, ASSISTANT ENGINEER RECEIPT UNDER THE INDIAN ELECTRICITY RULE -EI fee for Reconducting of 11KV HT from 4 pole Nangran to",1,300
UNA00-950-CHIEF ELECTRICAL INSPECTOR,0043-TAXES & DUTIES ON ELECTRICITY,0043-00-102-01-RECEIPT UNDER THE INDIAN ELECTRICITY RULE,19/05/2017,"[G0043000006] HIMGRN:B17E130660, ESD UNA-II RECEIPT UNDER THE INDIAN ELECTRICITY RULE -Inspection fee for SOP to 58.300 KW load of Director PNB",1,600
UNA00-950-CHIEF ELECTRICAL INSPECTOR,0043-TAXES & DUTIES ON ELECTRICITY,0043-00-102-01-RECEIPT UNDER THE INDIAN ELECTRICITY RULE,03/06/2017,"[H0043000001] HIMGRN:B17F103751, UMESH CHAUDHARY RECEIPT UNDER THE INDIAN ELECTRICITY RULE -Inspection fee for 54.60KW load to Superintending Enginee",1,600
UNA00-950-CHIEF ELECTRICAL INSPECTOR,0043-TAXES & DUTIES ON ELECTRICITY,0043-00-102-01-RECEIPT UNDER THE INDIAN ELECTRICITY RULE,05/07/2017,"[I0043000001] HIMGRN:B17G108114, ASSISTANT ENGINEER RECEIPT UNDER THE INDIAN ELECTRICITY RULE -EI fee for Recond. of 6/1/3.35mm cond. with 7/4.26mm cond",1,400
UNA00-950-CHIEF ELECTRICAL INSPECTOR,0043-TAXES & DUTIES ON ELECTRICITY,0043-00-102-01-RECEIPT UNDER THE INDIAN ELECTRICITY RULE,20/07/2017,"[I0043000004] HIMGRN:B17G132133, BALAJI STON CRUSHER RECEIPT UNDER THE INDIAN ELECTRICITY RULE -",1,2000
UNA00-950-CHIEF ELECTRICAL INSPECTOR,0043-TAXES & DUTIES ON ELECTRICITY,0043-00-102-01-RECEIPT UNDER THE INDIAN ELECTRICITY RULE,05/08/2017,"[J0043000001] HIMGRN:B17H106909, SR. EXECUTIVE ENGINEER E.S.DIVISION RAKKAR UNA RECEIPT UNDER THE INDIAN ELECTRICITY RULE -",1,7200
UNA00-950-CHIEF ELECTRICAL INSPECTOR,0043-TAXES & DUTIES ON ELECTRICITY,0043-00-102-01-RECEIPT UNDER THE INDIAN ELECTRICITY RULE,17/08/2017,"[J0043000003] HIMGRN:B17H116082, NARINDER PAUL RECEIPT UNDER THE INDIAN ELECTRICITY RULE -",1,1000
UNA00-950-CHIEF ELECTRICAL INSPECTOR,0043-TAXES & DUTIES ON ELECTRICITY,0043-00-102-01-RECEIPT UNDER THE INDIAN ELECTRICITY RULE,17/08/2017,"[J0043000004] HIMGRN:B17H115443, KANWAR HOSPITAL RECEIPT UNDER THE INDIAN ELECTRICITY RULE -",1,900
UNA00-950-CHIEF ELECTRICAL INSPECTOR,0043-TAXES & DUTIES ON ELECTRICITY,0043-00-102-01-RECEIPT UNDER THE INDIAN ELECTRICITY RULE,17/08/2017,"[J0043000005] HIMGRN:B17H119649, BHARTI INFRATEL RECEIPT UNDER THE INDIAN ELECTRICITY RULE -fee",1,900
UNA00-950-CHIEF ELECTRICAL INSPECTOR,0043-TAXES & DUTIES ON ELECTRICITY,0043-00-102-01-RECEIPT UNDER THE INDIAN ELECTRICITY RULE,23/08/2017,"[J0043000006] HIMGRN:B17H125620, YASHWINDER SINGH RECEIPT UNDER THE INDIAN ELECTRICITY RULE -FEE",1,1200
UNA00-950-CHIEF ELECTRICAL INSPECTOR,0043-TAXES & DUTIES ON ELECTRICITY,0043-00-102-01-RECEIPT UNDER THE INDIAN ELECTRICITY RULE,29/08/2017,"[J0043000011] HIMGRN:B17H136347, ASSISTANT ENGINEER RECEIPT UNDER THE INDIAN ELECTRICITY RULE -Estimate for shifting of 11KV HT and 3-phase LT line of I",1,400
UNA00-950-CHIEF ELECTRICAL INSPECTOR,0043-TAXES & DUTIES ON ELECTRICITY,0043-00-102-01-RECEIPT UNDER THE INDIAN ELECTRICITY RULE,29/08/2017,"[J0043000012] HIMGRN:B17H136350, ASSISTANT ENGINEER RECEIPT UNDER THE INDIAN ELECTRICITY RULE -Estimate for Reconducting of 7/2.21 mm conductor of LT Li",1,200
UNA00-950-CHIEF ELECTRICAL INSPECTOR,0043-TAXES & DUTIES ON ELECTRICITY,0043-00-102-01-RECEIPT UNDER THE INDIAN ELECTRICITY RULE,29/08/2017,"[J0043000013] HIMGRN:B17H136349, ASSISTANT ENGINEER RECEIPT UNDER THE INDIAN ELECTRICITY RULE -Estimate for Reconducting of 7/2.00 mm conductor of LT Li",1,200
UNA00-950-CHIEF ELECTRICAL INSPECTOR,0043-TAXES & DUTIES ON ELECTRICITY,0043-00-102-01-RECEIPT UNDER THE INDIAN ELECTRICITY RULE,04/10/2017,"[L0043000001] HIMGRN:B17J103056, UMESH CHAUDHARY RECEIPT UNDER THE INDIAN ELECTRICITY RULE -Estimate for providing 11/0.4 KV 100KVA Sub-station at Vi",1,600
UNA00-950-CHIEF ELECTRICAL INSPECTOR,0043-TAXES & DUTIES ON ELECTRICITY,0043-00-102-01-RECEIPT UNDER THE INDIAN ELECTRICITY RULE,23/11/2017,"[M0043000006] HIMGRN:B17K124099, MANIKA MOULDS PVT LTD RECEIPT UNDER THE INDIAN ELECTRICITY RULE -11 KV HT Line 1250 KVA transormer and LT Installation",1,5000
UNA00-950-CHIEF ELECTRICAL INSPECTOR,0043-TAXES & DUTIES ON ELECTRICITY,0043-00-102-01-RECEIPT UNDER THE INDIAN ELECTRICITY RULE,04/01/2018,"[C0043000001] HIMGRN:B17L139679, ASSISTANT ENGINEER RECEIPT UNDER THE INDIAN ELECTRICITY RULE -EI fee for SOP to 4 No agriculture tubewell connection in",1,700
UNA00-950-CHIEF ELECTRICAL INSPECTOR,0043-TAXES & DUTIES ON ELECTRICITY,0043-00-102-01-RECEIPT UNDER THE INDIAN ELECTRICITY RULE,04/01/2018,"[C0043000002] HIMGRN:B18A104081, ASSISTANT ENGINEER RECEIPT UNDER THE INDIAN ELECTRICITY RULE -Ei fee for sop to 80 kW load to hrtc workshops at village",1,900
UNA00-950-CHIEF ELECTRICAL INSPECTOR,0043-TAXES & DUTIES ON ELECTRICITY,0043-00-102-01-RECEIPT UNDER THE INDIAN ELECTRICITY RULE,04/01/2018,"[C0043000003] HIMGRN:B17L139648, ASSISTANT ENGINEER RECEIPT UNDER THE INDIAN ELECTRICITY RULE -EI fee for SOP to 6 No agriculture tubewell connection in",1,800
UNA00-950-CHIEF ELECTRICAL INSPECTOR,0043-TAXES & DUTIES ON ELECTRICITY,0043-00-102-01-RECEIPT UNDER THE INDIAN ELECTRICITY RULE,04/01/2018,"[C0043000004] HIMGRN:B17L139670, ASSSITANT ENGINEER RECEIPT UNDER THE INDIAN ELECTRICITY RULE -EI fee for SOP to 5 No agriculture tubewell connection in",1,800
UNA00-950-CHIEF ELECTRICAL INSPECTOR,0043-TAXES & DUTIES ON ELECTRICITY,0043-00-102-01-RECEIPT UNDER THE INDIAN ELECTRICITY RULE,03/02/2018,"[D0043000001] HIMGRN:B18B101668, NESTLE INDIA LIMITED RECEIPT UNDER THE INDIAN ELECTRICITY RULE -Electrical Installation Inspection Fees for Nestle india",1,19000
UNA00-950-CHIEF ELECTRICAL INSPECTOR,0043-TAXES & DUTIES ON ELECTRICITY,0043-00-102-01-RECEIPT UNDER THE INDIAN ELECTRICITY RULE,06/02/2018,"[D0043000002] HIMGRN:B18B107714, BHARTI INFRATEL RECEIPT UNDER THE INDIAN ELECTRICITY RULE -fee",1,900
UNA00-950-CHIEF ELECTRICAL INSPECTOR,0043-TAXES & DUTIES ON ELECTRICITY,0043-00-102-01-RECEIPT UNDER THE INDIAN ELECTRICITY RULE,06/02/2018,"[D0043000003] HIMGRN:B18B107566, ASSISTANT ENGINEER RECEIPT UNDER THE INDIAN ELECTRICITY RULE -Ei fee for CT PT unit for sop to 80 kW load to hrtc works",1,200
UNA00-950-CHIEF ELECTRICAL INSPECTOR,0043-TAXES & DUTIES ON ELECTRICITY,0043-00-102-01-RECEIPT UNDER THE INDIAN ELECTRICITY RULE,08/02/2018,"[D0043000004] HIMGRN:B18B111016, ASSISTANT ENGINEER RECEIPT UNDER THE INDIAN ELECTRICITY RULE -EI fee for SOP to 22.50 BHP m/c at village jattpur under",1,800
UNA00-950-CHIEF ELECTRICAL INSPECTOR,0043-TAXES & DUTIES ON ELECTRICITY,0043-00-102-01-RECEIPT UNDER THE INDIAN ELECTRICITY RULE,28/02/2018,"[D0043000009] HIMGRN:B18B134897, ASSISTANT ENGINEER RECEIPT UNDER THE INDIAN ELECTRICITY RULE -EI fee for estimate for 11kv Ht line , 63 kva transformer",1,800
UNA00-950-CHIEF ELECTRICAL INSPECTOR,0043-TAXES & DUTIES ON ELECTRICITY,0043-00-102-01-RECEIPT UNDER THE INDIAN ELECTRICITY RULE,28/02/2018,"[D0043000010] HIMGRN:B18B134899, ASSISTANT ENGINEER RECEIPT UNDER THE INDIAN ELECTRICITY RULE -EI fee for estimate for SOP to 80 kW load to HRTC worksho",1,200
UNA00-950-CHIEF ELECTRICAL INSPECTOR,0043-TAXES & DUTIES ON ELECTRICITY,0043-00-102-01-RECEIPT UNDER THE INDIAN ELECTRICITY RULE,20/03/2018,"[E0043000001] HIMGRN:B18C133738, SRI SRI RUDRA STONE CRUSHER AND SCREENING PLANT RECEIPT UNDER THE INDIAN ELECTRICITY RULE -INSPECTION FEE",1,1400
UNA00-950-CHIEF ELECTRICAL INSPECTOR,0043-TAXES & DUTIES ON ELECTRICITY,0043-00-102-01-RECEIPT UNDER THE INDIAN ELECTRICITY RULE,28/03/2018,"[E0043000004] HIMGRN:B18C153094, ASSISTANT ENGINEER RECEIPT UNDER THE INDIAN ELECTRICITY RULE -EI fee for 49 kW load of HRTC workshop at rampur bela und",1,200
UNA00-950-CHIEF ELECTRICAL INSPECTOR,0043-TAXES & DUTIES ON ELECTRICITY,0043-00-102-01-RECEIPT UNDER THE INDIAN ELECTRICITY RULE,05/04/2018,"[F0043000001] HIMGRN:B18D113280, ASSISTANT ENGINEER RECEIPT UNDER THE INDIAN ELECTRICITY RULE -EI fee for estimate for prov 11kv Ht line Santokhgarh san",1,300
UNA00-950-CHIEF ELECTRICAL INSPECTOR,0043-TAXES & DUTIES ON ELECTRICITY,0043-00-102-01-RECEIPT UNDER THE INDIAN ELECTRICITY RULE,15/05/2018,"[G0043000002] HIMGRN:B18E125190, ASSISTANT ENGINEER RECEIPT UNDER THE INDIAN ELECTRICITY RULE -EI fee for 63 kva transformer and 3 phase Lt line takhatp",1,600
UNA00-950-CHIEF ELECTRICAL INSPECTOR,0043-TAXES & DUTIES ON ELECTRICITY,0043-00-102-01-RECEIPT UNDER THE INDIAN ELECTRICITY RULE,15/05/2018,"[G0043000003] HIMGRN:B18E125350, ASSISTANT ENGINEER RECEIPT UNDER THE INDIAN ELECTRICITY RULE -Estimate for prov 25 kva transformer. HT line and 3 phase",1,700
UNA00-950-CHIEF ELECTRICAL INSPECTOR,0043-TAXES & DUTIES ON ELECTRICITY,0043-00-102-01-RECEIPT UNDER THE INDIAN ELECTRICITY RULE,13/06/2018,"[H0043000001] HIMGRN:B18F118652, ASSISTANT ENGINEER RECEIPT UNDER THE INDIAN ELECTRICITY RULE -EI fee for 49KW load of HRTC Workshop at rampur under ESD",1,100
UNA00-950-CHIEF ELECTRICAL INSPECTOR,0043-TAXES & DUTIES ON ELECTRICITY,0043-00-102-01-RECEIPT UNDER THE INDIAN ELECTRICITY RULE,27/06/2018,"[H0043000002] HIMGRN:B18F140218, VISHAL INDUSTRY RECEIPT UNDER THE INDIAN ELECTRICITY RULE -",1,250
UNA00-950-CHIEF ELECTRICAL INSPECTOR,0043-TAXES & DUTIES ON ELECTRICITY,0043-00-102-01-RECEIPT UNDER THE INDIAN ELECTRICITY RULE,02/07/2018,"[I0043000001] HIMGRN:B18F146482, ASSISTANT ENGINEER RECEIPT UNDER THE INDIAN ELECTRICITY RULE -ei FEE FOR 100kva tRANSFORMER AND 3 PHASE lt LINE AT VILL",1,600
UNA00-950-CHIEF ELECTRICAL INSPECTOR,0043-TAXES & DUTIES ON ELECTRICITY,0043-00-102-01-RECEIPT UNDER THE INDIAN ELECTRICITY RULE,16/07/2018,"[I0043000006] HIMGRN:B18G123089, ASSISTANT ELECTRICAL INSPECTOR HPSEBL UNA RECEIPT UNDER THE INDIAN ELECTRICITY RULE -fees for inspection of 63kva s/stn at village malhat and",1,1200
UNA00-950-CHIEF ELECTRICAL INSPECTOR,0043-TAXES & DUTIES ON ELECTRICITY,0043-00-102-01-RECEIPT UNDER THE INDIAN ELECTRICITY RULE,26/07/2018,"[I0043000007] HIMGRN:B18G142788, HPSEB RECEIPT UNDER THE INDIAN ELECTRICITY RULE -Aug. of 2X4MVA,33/11KV Power Transformer to 2X6.3MVA capa",1,1500
UNA00-950-CHIEF ELECTRICAL INSPECTOR,0043-TAXES & DUTIES ON ELECTRICITY,0043-00-102-01-RECEIPT UNDER THE INDIAN ELECTRICITY RULE,23/08/2018,"[J0043000001] HIMGRN:B18H116033, JAIN PLASTIC RECEIPT UNDER THE INDIAN ELECTRICITY RULE -",1,1300
UNA00-950-CHIEF ELECTRICAL INSPECTOR,0043-TAXES & DUTIES ON ELECTRICITY,0043-00-102-01-RECEIPT UNDER THE INDIAN ELECTRICITY RULE,23/08/2018,"[J0043000002] HIMGRN:B18H116036, GOLDEN PARADISE RECEIPT UNDER THE INDIAN ELECTRICITY RULE -",1,1300
UNA00-950-CHIEF ELECTRICAL INSPECTOR,0043-TAXES & DUTIES ON ELECTRICITY,0043-00-102-01-RECEIPT UNDER THE INDIAN ELECTRICITY RULE,29/08/2018,"[J0043000005] HIMGRN:B18H138013, SR EXECUTIVE ENGINEER RECEIPT UNDER THE INDIAN ELECTRICITY RULE -Aug. of 4MVA ,33/11KV Power Transformer to 6.3MVA ,33/11K",1,1500
UNA00-950-CHIEF ELECTRICAL INSPECTOR,0043-TAXES & DUTIES ON ELECTRICITY,0043-00-103-01-RECEIPT FROM THE ELECTRICITY INSPECTION OF CINEMA,04/05/2017,"[G0043000001] HIMGRN:B17E107044, RAJINDER VASHISTA RECEIPT FROM THE ELECTRICITY INSPECTION OF CINEMA -FEE",1,200
UNA00-950-CHIEF ELECTRICAL INSPECTOR,0043-TAXES & DUTIES ON ELECTRICITY,0043-00-800-01-MISCELLANEOUS RECEIPTS,05/04/2017,"[F0043000001] HIMGRN:B17D109438, PRASHANT DHIMAN MISCELLANEOUS RECEIPTS -",1,750
UNA00-950-CHIEF ELECTRICAL INSPECTOR,0043-TAXES & DUTIES ON ELECTRICITY,0043-00-800-01-MISCELLANEOUS RECEIPTS,20/04/2017,"[F0043000007] HIMGRN:B17D149012, ROHIT KUMAR S/O RAJINDER KUMAR MISCELLANEOUS RECEIPTS -wireman permit",1,500
UNA00-950-CHIEF ELECTRICAL INSPECTOR,0043-TAXES & DUTIES ON ELECTRICITY,0043-00-800-01-MISCELLANEOUS RECEIPTS,18/07/2017,"[I0043000002] HIMGRN:B17G128792, RAHUL MISCELLANEOUS RECEIPTS -",1,200
UNA00-950-CHIEF ELECTRICAL INSPECTOR,0043-TAXES & DUTIES ON ELECTRICITY,0043-00-800-01-MISCELLANEOUS RECEIPTS,18/07/2017,"[I0043000003] HIMGRN:B17G128841, MANISH KUMAR MISCELLANEOUS RECEIPTS -",1,200
UNA00-950-CHIEF ELECTRICAL INSPECTOR,0043-TAXES & DUTIES ON ELECTRICITY,0043-00-800-01-MISCELLANEOUS RECEIPTS,07/09/2017,"[K0043000001] HIMGRN:B17I108037, MOHINDER SINGH S/O SWARAN SINGH MISCELLANEOUS RECEIPTS -wire man permit renewal fees",1,600
UNA00-950-CHIEF ELECTRICAL INSPECTOR,0043-TAXES & DUTIES ON ELECTRICITY,0043-00-800-01-MISCELLANEOUS RECEIPTS,08/11/2017,"[M0043000001] HIMGRN:B17K106715, DEVINDER KUMAR S/O KRISHAN CHANDER MISCELLANEOUS RECEIPTS -A-704",1,4000
UNA00-950-CHIEF ELECTRICAL INSPECTOR,0043-TAXES & DUTIES ON ELECTRICITY,0043-00-800-01-MISCELLANEOUS RECEIPTS,08/11/2017,"[M0043000002] HIMGRN:B17K106710, RAMESH CHAND S/O GIAN CHAND MISCELLANEOUS RECEIPTS -A-700",1,4000
UNA00-950-CHIEF ELECTRICAL INSPECTOR,0043-TAXES & DUTIES ON ELECTRICITY,0043-00-800-01-MISCELLANEOUS RECEIPTS,21/02/2018,"[D0043000005] HIMGRN:B18B124171, MANISH KUMAR MISCELLANEOUS RECEIPTS -FEE",1,500
UNA00-950-CHIEF ELECTRICAL INSPECTOR,0043-TAXES & DUTIES ON ELECTRICITY,0043-00-800-01-MISCELLANEOUS RECEIPTS,06/04/2018,"[F0043000002] HIMGRN:B18D117695, NARDEV CHAND MISCELLANEOUS RECEIPTS -",1,4000
UNA00-950-CHIEF ELECTRICAL INSPECTOR,0043-TAXES & DUTIES ON ELECTRICITY,0043-00-800-01-MISCELLANEOUS RECEIPTS,06/04/2018,"[F0043000003] HIMGRN:B18D117763, TARLOK SINGH MISCELLANEOUS RECEIPTS -",1,750
UNA00-950-CHIEF ELECTRICAL INSPECTOR,0043-TAXES & DUTIES ON ELECTRICITY,0043-00-800-01-MISCELLANEOUS RECEIPTS,06/04/2018,"[F0043000004] HIMGRN:B18D117780, SANJEEV KUMAR MISCELLANEOUS RECEIPTS -",1,750
UNA00-950-CHIEF ELECTRICAL INSPECTOR,0043-TAXES & DUTIES ON ELECTRICITY,0043-00-800-01-MISCELLANEOUS RECEIPTS,06/04/2018,"[F0043000005] HIMGRN:B18D117804, NITISH MALHOTRA MISCELLANEOUS RECEIPTS -",1,750
UNA00-950-CHIEF ELECTRICAL INSPECTOR,0043-TAXES & DUTIES ON ELECTRICITY,0043-00-800-01-MISCELLANEOUS RECEIPTS,19/04/2018,"[F0043000007] HIMGRN:B18D152306, RAJINDER KUMAR S/O ACCHAR SINGH MISCELLANEOUS RECEIPTS -WIREMAN PARMIT NO. 4546",1,500
UNA00-950-CHIEF ELECTRICAL INSPECTOR,0043-TAXES & DUTIES ON ELECTRICITY,0043-00-800-01-MISCELLANEOUS RECEIPTS,19/04/2018,"[F0043000008] HIMGRN:B18D152263, RAJINDER KUMAR S/O ACCHAR SINGH MISCELLANEOUS RECEIPTS -C-CLASS CONTRACTOR LICENCE FORM FEE",1,100
UNA00-950-CHIEF ELECTRICAL INSPECTOR,0043-TAXES & DUTIES ON ELECTRICITY,0043-00-800-01-MISCELLANEOUS RECEIPTS,25/04/2018,"[F0043000009] HIMGRN:B18D166280, SENIOR EXECUTIVE ENGINEER MISCELLANEOUS RECEIPTS -",1,6300
UNA00-950-CHIEF ELECTRICAL INSPECTOR,0043-TAXES & DUTIES ON ELECTRICITY,0043-00-800-01-MISCELLANEOUS RECEIPTS,12/07/2018,"[I0043000004] HIMGRN:B18G119650, AMANKUMAR BHATTI MISCELLANEOUS RECEIPTS -Cash On account Wireman permit examination fee",1,200
UNA00-950-CHIEF ELECTRICAL INSPECTOR,0043-TAXES & DUTIES ON ELECTRICITY,0043-00-800-01-MISCELLANEOUS RECEIPTS,12/07/2018,"[I0043000005] HIMGRN:B18G118479, RAJINDER SINGH MISCELLANEOUS RECEIPTS -On account of wireman permit examination fee",1,200
UNA00-950-CHIEF ELECTRICAL INSPECTOR,0235-SOCIAL SECURITY & WELFARE,0235-60-105-02-INDEX PERSONAL INSURANCE ACCIDENT SCHEME FOR GOVT. EMPLOYEES.,22/12/2017,"[N0235000038] HIMGRN:B17L120950, ADDL SE ELECT DIV HPSEBL RAKKAR UNA INDEX PERSONAL INSURANCE ACCIDENT SCHEME FOR GOVT EMP -emp insurance scheme",1,23600
UNA00-950-CHIEF ELECTRICAL INSPECTOR,0235-SOCIAL SECURITY & WELFARE,0235-60-105-02-INDEX PERSONAL INSURANCE ACCIDENT SCHEME FOR GOVT. EMPLOYEES.,05/01/2018,"[C0235000006] HIMGRN:B17L133874, SR EXE ENG INDEX PERSONAL INSURANCE ACCIDENT SCHEME FOR GOVT EMP -CHEQUE NO 673311 DT 26-12-2017",1,11200
UNA00-950-CHIEF ELECTRICAL INSPECTOR,0235-SOCIAL SECURITY & WELFARE,0235-60-105-02-INDEX PERSONAL INSURANCE ACCIDENT SCHEME FOR GOVT. EMPLOYEES.,29/01/2018,"[C0235000020] HIMGRN:B18A135658, ADIDTIONAL INDEX PERSONAL INSURANCE ACCIDENT SCHEME FOR GOVT EMP -INDEX PERSONAL INSURANCE ACCIDENT SCHEME FOR",1,2160
