DDODesc,MAJOR,RECEIPTHEAD,BOOKDATE,Tenderer,Challan,NETRECEIPT
SML00-237-GSSS KOTGEHA,"0202-EDUCATION SPORTS,ARTS & CULTURE",0202-01-101-02-SECONDARY EDUCATION,21/04/2017,"[F0202000022] HIMGRN:B17D150614, KUSUM SHARMA SECONDARY EDUCATION -",1,1170
SML00-237-GSSS KOTGEHA,"0202-EDUCATION SPORTS,ARTS & CULTURE",0202-01-102-01-TUITION AND OTHER FEES,11/10/2017,"[L0202000012] HIMGRN:B17J113106, PRINCIPAL GSSS KOTGEHA TUITION AND OTHER FEES -",1,1020
SML00-237-GSSS KOTGEHA,"0202-EDUCATION SPORTS,ARTS & CULTURE",0202-01-102-01-TUITION AND OTHER FEES,29/12/2017,"[N0202000044] HIMGRN:B17L134130, KUSUM SHARMA TUITION AND OTHER FEES -",1,810
SML00-237-GSSS KOTGEHA,"0202-EDUCATION SPORTS,ARTS & CULTURE",0202-01-102-01-TUITION AND OTHER FEES,26/03/2018,"[E0202000049] HIMGRN:B18C145286, PRINCIPAL TUITION AND OTHER FEES -",1,810
SML00-237-GSSS KOTGEHA,"0202-EDUCATION SPORTS,ARTS & CULTURE",0202-01-102-01-TUITION AND OTHER FEES,25/06/2018,"[H0202000031] HIMGRN:B18F134434, PRINCIPAL GSSS KOTGEHA TUITION AND OTHER FEES -",1,1071
