DDODesc,MAJOR,RECEIPTHEAD,BOOKDATE,Tenderer,Challan,NETRECEIPT
KNG09-003-P.R.T.I BAIJNATH,0515-OTHER RURAL DEVELOPMENT PROGRAMMES,0515-00-800-02-MISC. RECEIPT FROM PANCHAYATI RAJ,31/05/2017,"[G0515000001] HIMGRN:B17E107454, PRTI BAIJNATH MISC. RECEIPT FROM PANCHAYATI RAJ -Recovery of Medical Reimbursement in R/o Sh. Ramesh Chand (Instru",1,575
KNG09-003-P.R.T.I BAIJNATH,0515-OTHER RURAL DEVELOPMENT PROGRAMMES,0515-00-800-02-MISC. RECEIPT FROM PANCHAYATI RAJ,31/05/2017,"[G0515000002] HIMGRN:B17E119835, PRTI BAIJNATH MISC. RECEIPT FROM PANCHAYATI RAJ -Outstanding Amount in General Cash Book (01-10-2005) Audit Para 3",1,300
KNG09-003-P.R.T.I BAIJNATH,0515-OTHER RURAL DEVELOPMENT PROGRAMMES,0515-00-800-02-MISC. RECEIPT FROM PANCHAYATI RAJ,24/05/2018,"[G0515000001] HIMGRN:B18E120823, RAMESH CHAND MINHAS MISC. RECEIPT FROM PANCHAYATI RAJ -Regarding Recovery of HRA 400/-Rs. due to over payment in the Mon",1,400
KNG09-003-P.R.T.I BAIJNATH,0515-OTHER RURAL DEVELOPMENT PROGRAMMES,0515-00-800-02-MISC. RECEIPT FROM PANCHAYATI RAJ,16/07/2018,"[I0515000001] HIMGRN:B18G106168, BIRBAL CHOUDHARY MISC. RECEIPT FROM PANCHAYATI RAJ -Regarding Recovery Over Payment M.R bill of Sh. Birbal Choudhary",1,850
KNG09-003-P.R.T.I BAIJNATH,"7610-LOANS TO GOVERNMENT SERVANTS , ETC.",7610-00-800-04-Education Loan,31/08/2018,"[J7610000001] HIMGRN:B18H138678, PRINCIPAL PRTI BAIJNATH EDUCATION LOAN -Recovery of One installment of Education Loan",1,1250
